<!ELEMENT STUDENTS (TITLE?,STUDENT*)>
<!ELEMENT TITLE(#PCDATA)>
<!ELEMENT STUDENT (NAME,ROLLNO,SUB*)>
<!ELEMENT NAME(#PCDATA)>
<!ELEMENT ROLLNO(#PCDATA)>
<!ELEMENT SUB(SUBNAME,MARKS)>
<!ELEMENT SUBNAME(#PCDATA)>
<!ELEMENT MARKS(#PCDATA)>